{
  "$schema": "https://json-schema.org/draft/2020-12/schema",
  "$id": "https://example.com/normalized-cost-asset.schema.json",
  "title": "Normalized Cost And Asset Record",
  "type": "object",
  "required": [
    "provider",
    "resource_id",
    "resource_type",
    "environment",
    "owner",
    "service",
    "region",
    "cost_amount",
    "cost_currency",
    "usage_quantity",
    "usage_unit",
    "timestamp"
  ],
  "properties": {
    "provider": {
      "type": "string",
      "enum": ["gcp", "aws", "azure"]
    },
    "resource_id": {
      "type": "string",
      "minLength": 1
    },
    "resource_type": {
      "type": "string",
      "minLength": 1
    },
    "environment": {
      "type": "string",
      "minLength": 1
    },
    "owner": {
      "type": "string",
      "minLength": 1
    },
    "service": {
      "type": "string",
      "minLength": 1
    },
    "region": {
      "type": "string",
      "minLength": 1
    },
    "cost_amount": {
      "type": "number",
      "minimum": 0
    },
    "cost_currency": {
      "type": "string",
      "pattern": "^[A-Z]{3}$"
    },
    "usage_quantity": {
      "type": "number",
      "minimum": 0
    },
    "usage_unit": {
      "type": "string",
      "minLength": 1
    },
    "timestamp": {
      "type": "string",
      "format": "date-time"
    },
    "tags": {
      "type": "object",
      "additionalProperties": {
        "type": "string"
      },
      "default": {}
    }
  },
  "additionalProperties": false
}
